{
  "name": "tracelab-jsonl",
  "version": 1,
  "source_format": "jsonl",
  "constants": {
    "source_name": "TraceLab"
  },
  "unmapped_fields": [
    "project",
    "round_id",
    "user",
    "store",
    "trace_key",
    "tool_call_id",
    "tool_internal_wait_ms",
    "reasoning_output_tokens",
    "prefix_tokens",
    "newly_append_tokens",
    "claude_uncached_input_tokens",
    "claude_cache_creation_input_tokens"
  ],
  "entities": {
    "session": {
      "iterate": {
        "path": ""
      },
      "identity": {
        "key_fields": [
          "session_id"
        ]
      },
      "fields": {
        "external_id": {
          "from": "session_id",
          "required": true,
          "on_error": "reject"
        },
        "agent_name": {
          "from": "provider"
        }
      }
    },
    "model_call": {
      "iterate": {
        "path": ""
      },
      "parent": {
        "entity": "session",
        "key_from": "session_id"
      },
      "identity": {
        "key_fields": [
          "session_id",
          "round_index"
        ]
      },
      "fields": {
        "sequence": {
          "from": "round_index",
          "transform": "to_int"
        },
        "model_name": {
          "from": "model",
          "required": true,
          "on_error": "reject"
        },
        "provider": {
          "from": "provider"
        },
        "prompt_tokens": {
          "from": "input_tokens_total",
          "transform": "to_int"
        },
        "completion_tokens": {
          "from": "output_tokens",
          "transform": "to_int"
        },
        "cached_tokens": {
          "from": "claude_cache_read_input_tokens",
          "transform": "to_int"
        },
        "started_at": {
          "from": "timing_events.0.timestamp"
        },
        "ended_at": {
          "from": "timing_events.-1.timestamp"
        }
      }
    },
    "tool_call": {
      "iterate": {
        "path": "tools"
      },
      "parent": {
        "entity": "session",
        "key_from": "session_id"
      },
      "identity": {
        "key_fields": [
          "session_id",
          "round_index",
          "tool_index"
        ]
      },
      "fields": {
        "tool_name": {
          "from": "tool_name",
          "required": true,
          "on_error": "reject"
        },
        "model_call_sequence": {
          "from": "round_index",
          "transform": "to_int"
        },
        "status": {
          "from": "is_error",
          "transform": "map_enum",
          "args": {
            "mapping": {
              "true": "error",
              "false": "success"
            }
          }
        },
        "error_type": {
          "from": "is_error",
          "transform": "map_enum",
          "args": {
            "mapping": {
              "true": "tool_error"
            }
          }
        },
        "input_bytes": {
          "from": "input_chars",
          "transform": "to_int"
        },
        "output_bytes": {
          "from": "result_chars",
          "transform": "to_int"
        },
        "started_at": {
          "from": "emitted_at"
        },
        "ended_at": {
          "from": "result_at"
        }
      }
    }
  }
}
